{
  "$schema": "http://json-schema.org/draft-07/schema#",
  "title": "Video Studio storyboard",
  "description": "One video. Mirrors src/storyboard-schema.mjs, which is the real validator: this file only drives editor autocomplete and inline errors. If the two ever disagree, the .mjs wins and `npm run render` is the arbiter.",
  "type": "object",
  "required": ["id", "scenes"],
  "additionalProperties": false,
  "properties": {
    "id": {
      "type": "string",
      "pattern": "^[a-z0-9]+(-[a-z0-9]+)*$",
      "description": "Lower-case kebab-case. Becomes the output filename: out/<id>.mp4."
    },
    "width": { "type": "integer", "default": 1920, "description": "Must be even (H.264 yuv420p)." },
    "height": { "type": "integer", "default": 1080, "description": "Must be even (H.264 yuv420p)." },
    "fps": { "type": "integer", "minimum": 1, "default": 30 },
    "theme": {
      "type": "string",
      "enum": ["dark", "light"],
      "default": "dark",
      "description": "Drawn scenes use this. verify FAILS if a capture's measured appearance does not match it."
    },
    "voiceover": {
      "type": "string",
      "description": "Path from tools/video-studio, e.g. assets/vo/my-video.mp3. Regenerate the mp3 after editing the .txt."
    },
    "captions": {
      "type": "boolean",
      "default": false,
      "description": "Burn in captions and write a .vtt. Requires voiceover. Word timings come from whisper."
    },
    "posterFrame": {
      "type": "integer",
      "minimum": 0,
      "description": "Frame index for the .jpg poster. Defaults to 1s into scene 2."
    },
    "format": {
      "type": "string",
      "enum": ["landscape", "vertical"],
      "default": "landscape",
      "description": "vertical = the 1080x1920 short (TikTok, Reels, Shorts). Sets width and height; text stays out of the bottom 20% and the right-hand rail. Requires post."
    },
    "automated": {
      "type": "boolean",
      "default": false,
      "description": "Written by a routine with nobody watching. Refuses capture scenes, which need a human-signed-in session."
    },
    "timer": {
      "type": "object",
      "required": ["from", "to"],
      "additionalProperties": false,
      "description": "Stopwatch overlay from the start of scene `from` to the answer (or the end) of scene `to`. Counts video time, not server latency.",
      "properties": {
        "from": { "type": "integer", "minimum": 0 },
        "to": { "type": "integer", "minimum": 0 },
        "label": { "type": "string" }
      }
    },
    "post": {
      "type": "object",
      "required": ["caption"],
      "additionalProperties": false,
      "description": "Copy for out/<id>.post.json, which verify writes on a pass. Nothing is posted.",
      "properties": {
        "caption": { "type": "string", "maxLength": 2200 },
        "hashtags": { "type": "array", "maxItems": 8, "items": { "type": "string", "pattern": "^#?[A-Za-z0-9_]{2,40}$" } },
        "sourceUrl": { "type": "string", "pattern": "^https://" }
      }
    },
    "scenes": {
      "type": "array",
      "minItems": 1,
      "description": "Played in order. No scene may be shorter than 1.5s.",
      "items": {
        "type": "object",
        "required": ["type"],
        "properties": {
          "type": { "type": "string", "enum": ["title", "capture", "chat", "terminal", "outro", "clip", "query"] }
        },
        "allOf": [
          {
            "if": { "properties": { "type": { "const": "title" } }, "required": ["type"] },
            "then": {
              "required": ["type", "durationInSeconds", "headline"],
              "additionalProperties": false,
              "properties": {
                "type": { "const": "title" },
                "durationInSeconds": { "type": "number", "minimum": 1.5 },
                "headline": { "type": "string", "description": "No em dashes. The validator rejects them." },
                "sub": { "type": "string", "description": "No em dashes." },
                "align": { "type": "string", "enum": ["center", "left"], "default": "center" }
              }
            }
          },
          {
            "if": { "properties": { "type": { "const": "capture" } }, "required": ["type"] },
            "then": {
              "required": ["type", "shot"],
              "additionalProperties": false,
              "properties": {
                "type": { "const": "capture" },
                "shot": {
                  "type": "string",
                  "description": "Must match shots/<shot>.shot.mjs AND a completed capture in captures/."
                },
                "durationInSeconds": {
                  "type": "number",
                  "minimum": 1.5,
                  "description": "Normally omit: derived from the clip and speed."
                },
                "clip": {
                  "type": "object",
                  "additionalProperties": false,
                  "description": "Trim the recording. Almost every capture wants a `from` of about a second, or the cut opens on the browser's unpainted background.",
                  "properties": {
                    "from": { "type": "number", "minimum": 0, "description": "Defaults to the measured first paint." },
                    "to": { "type": "number", "minimum": 0, "description": "Leave out unless you must trim the tail: a pinned `to` breaks on the next take." }
                  }
                },
                "speed": { "type": "number", "exclusiveMinimum": 0, "default": 1, "description": "1.0 is real time. Below 1 slows playback, which stretches typing too." },
                "autoZoom": { "type": "boolean", "default": true, "description": "false gives a flat full frame, no camera and no cursor push-in." },
                "maxZoom": { "type": "number", "default": 1.8, "description": "Ceiling. Above ~1.8 a 1080p source visibly softens." },
                "frame": { "type": "string", "enum": ["browser", "laptop", "none"], "default": "browser" },
                "callouts": {
                  "type": "array",
                  "description": "At most two in a whole cut, and only where a viewer would otherwise miss something.",
                  "items": {
                    "type": "object",
                    "required": ["at", "for", "text"],
                    "additionalProperties": false,
                    "properties": {
                      "at": { "type": "number", "minimum": 0, "description": "Seconds from the START OF THE CLIP, not the recording." },
                      "for": { "type": "number", "exclusiveMinimum": 0 },
                      "text": { "type": "string", "description": "No em dashes." },
                      "anchor": { "type": "string", "enum": ["above", "below", "left", "right"], "description": "Overrides automatic placement." }
                    }
                  }
                }
              }
            }
          },
          {
            "if": { "properties": { "type": { "const": "chat" } }, "required": ["type"] },
            "then": {
              "required": ["type", "transcript", "durationInSeconds"],
              "additionalProperties": false,
              "properties": {
                "type": { "const": "chat" },
                "transcript": {
                  "type": "string",
                  "description": "Path from tools/video-studio, e.g. transcripts/my-video.json. Generated by `npm run transcript`. render refuses a failed or 14-day-old transcript."
                },
                "durationInSeconds": { "type": "number", "minimum": 1.5 },
                "title": { "type": "string", "default": "Your AI assistant", "description": "Keep it generic. Never another vendor's product name." }
              }
            }
          },
          {
            "if": { "properties": { "type": { "const": "terminal" } }, "required": ["type"] },
            "then": {
              "required": ["type", "durationInSeconds", "lines"],
              "additionalProperties": false,
              "properties": {
                "type": { "const": "terminal" },
                "durationInSeconds": { "type": "number", "minimum": 1.5 },
                "lines": {
                  "type": "array",
                  "minItems": 1,
                  "items": { "type": "string" },
                  "description": "Lines starting \"$ \" type character by character; everything else appears whole."
                },
                "title": { "type": "string", "default": "Terminal" },
                "cps": { "type": "number", "exclusiveMinimum": 0, "default": 28, "description": "Characters per second." }
              }
            }
          },
          {
            "if": { "properties": { "type": { "const": "outro" } }, "required": ["type"] },
            "then": {
              "required": ["type", "durationInSeconds", "cta"],
              "additionalProperties": false,
              "properties": {
                "type": { "const": "outro" },
                "durationInSeconds": { "type": "number", "minimum": 1.5 },
                "cta": { "type": "string", "description": "One CTA. No em dashes." },
                "sub": { "type": "string", "description": "No em dashes." }
              }
            }
          },
          {
            "if": { "properties": { "type": { "const": "clip" } }, "required": ["type"] },
            "then": {
              "required": ["type", "durationInSeconds", "src"],
              "additionalProperties": false,
              "properties": {
                "type": { "const": "clip" },
                "durationInSeconds": { "type": "number", "minimum": 1.5 },
                "src": { "type": "string", "pattern": "^assets/clips/[A-Za-z0-9._-]+\\.mp4$", "description": "A generated hook clip. Always drawn with an AI-generated badge." },
                "from": { "type": "number", "minimum": 0, "default": 0 },
                "caption": { "type": "string" },
                "muted": { "type": "boolean", "default": true }
              }
            }
          },
          {
            "if": { "properties": { "type": { "const": "query" } }, "required": ["type"] },
            "then": {
              "required": ["type", "durationInSeconds", "question", "platform", "sourceUrl"],
              "additionalProperties": false,
              "properties": {
                "type": { "const": "query" },
                "durationInSeconds": { "type": "number", "minimum": 1.5 },
                "question": { "type": "string", "maxLength": 160, "description": "Paraphrased. No handles, addresses or links." },
                "platform": { "type": "string", "enum": ["reddit", "x", "hacker-news", "stack-overflow", "github", "discord", "forum", "quora"] },
                "sourceUrl": { "type": "string", "pattern": "^https://", "description": "Never drawn. Goes to post.json." },
                "lead": { "type": "string", "description": "Replaces 'Someone asked on <platform>'." }
              }
            }
          }
        ]
      }
    }
  }
}
